Лига,вуз,Сайт,J,Jvikon,Jпаук
4,Сибайский институт (филиал) Башкирского государственного университета,http://www.sibsu.ru/,0.705,0.705,0.53
4,Калужский филиал РАНХиГС,http://klg.ranepa.ru/,0.704,0.704,0.666
4,Воронежский филиал РАНХиГС,https://vrn.ranepa.ru,0.704,0.704,0.513
4,Институт деловой карьеры,http://www.ideka.ru/,0.7,0.7,0.53
4,Ростовский государственный экономический университет (РИНХ),http://rsue.ru,0.7,0.7,0.523
5,Брянский государственный университет имени академика И.Г. Петровского,http://www.brgu.ru/,0.699,0.699,0.503
5,Филиал Брянского государственного университета имени академика И.Г.Петровского в г.Новозыбкове,http://www.brgu.ru,0.699,0.699,0.503
5,Поволжский институт (филиал) федерального государственного бюджетного образовательного учреждения высшего образования «Всероссийский государственный университет юстиции (РПА Минюста России)» в г. Саратове,https://saratov2.rpa-mu.ru,0.698,0.698,0.534
5,Курганский государственный университет,http://www.kgsu.ru/,0.697,0.697,0.52
5,Краснодарский филиал РЭУ им. Г.В. Плеханова,http://krasnodar.rea.ru,0.697,0.614,0.697
5,Оренбургский филиал Академии труда и социальных отношений,http://orenfil-atiso.ru,0.696,0.696,0.683
5,"Национальный исследовательский университет ""МИЭТ""",https://www.miet.ru,0.694,0.694,0.384
5,Оренбургская духовная семинария Оренбургской Епархии Русской Православной Церкви,http://orends.ru,0.694,0.694,0.384
5,Казанский государственный медицинский университет,https://kazangmu.ru/,0.693,0.693,0.578
5,Санкт-Петербургская православная духовная академия,http://spbda.ru/,0.693,0.693,0.578
5,Санкт-Петербургский государственный университет промышленных технологий и дизайна,http://sutd.ru/,0.693,0.693,0.578
5,Северо-Восточный государственный университет,http://www.svgu.ru/,0.693,0.693,0.578
5,Институт бизнеса и дизайна,http://www.obe.ru,0.693,0.693,0.506
5,Северо-Западный государственный медицинский университет имени И.И.Мечникова,http://www.szgmu.ru,0.691,0.691,0.571
5,Воронежский государственный технический университет,http://cchgeu.ru,0.689,0.689,0.574
5,Филиал Сочинского государственного университета в г.Анапа,http://www.anapauniver.ru/,0.689,0.689,0.574
5,Санкт-Петербургский государственный экономический университет,http://unecon.ru,0.688,0.688,0.574
5,Алтайский государственный технический университет им. И.И. Ползунова,https://www.altstu.ru/,0.687,0.687,0.578
5,Академия труда и социальных отношений,http://www.atiso.ru,0.687,0.66,0.687
5,"Институт менеджмента, экономики и инноваций",http://anoimei.ru/,0.686,0.686,0.54
5,"Филиал ""Университет “Дубна"" - Дмитровский институт непрерывного образования",http://dmitrov-dubna.ru/,0.685,0.685,0.574
5,Западный филиал РАНХиГС,http://zf.ranepa.ru,0.684,0.684,0.408
5,Кабардино-Балкарский государственный университет им. Х.М. Бербекова,http://www.kbsu.ru,0.683,0.683,0.574
5,Омский государственный университет путей сообщения,http://www.omgups.ru,0.683,0.683,0.551
5,Чувашский государственный педагогический университет им. И.Я. Яковлева,http://www.chgpu.edu.ru,0.682,0.682,0.554
5,Петербургский государственный университет путей сообщения Императора Александра I,http://www.pgups.ru,0.682,0.682,0.5
5,Одинцовский филиал «Московского государственного института международных отношений (университет) Министерства иностранных дел Российской Федерации»,http://odin.mgimo.ru,0.681,0.681,0.571
5,Московский областной филиал Московского финансово-юридического университета МФЮА,http://mf.mfua.ru/,0.68,0.68,0.384
5,Технологический институт (филиал) ДГТУ в г. Азове,http://www.atidstu.ru,0.679,0.679,0.476
5,Дальневосточный государственный технический рыбохозяйственный университет,http://www.dalrybvtuz.ru,0.677,0.677,0.568
5,Санкт-Петербургская государственная художественно-промышленная академия имени А.Л. Штиглица,http://www.ghpa.ru/,0.676,0.676,0.571
5,Набережночелнинский филиал Казанского инновационного университета имени В.Г.Тимирясова,http://chl.ieml.ru,0.676,0.676,0.561
5,Национальный исследовательский Мордовский государственный университет им. Н.П. Огарёва,http://www.mrsu.ru,0.676,0.676,0.53
5,Астраханский государственный технический университет,http://www.astu.org/,0.674,0.674,0.574
5,Барнаульская духовная семинария,http://altay-seminary.ru,0.673,0.673,0.561
5,Ивановская государственная медицинская академия,https://www.isma.ivanovo.ru/,0.673,0.517,0.673
5,Ухтинский государственный технический университет,http://www.ugtu.net,0.672,0.672,0.639
5,Поволжский государственный университет сервиса,http://www.tolgas.ru,0.672,0.672,0.479
5,"Филиал ""Воронежский государственный технический университет"" в г. Борисоглебске",http://bf.cchgeu.ru/,0.671,0.671,0.561
5,Бийский технологический институт (филиал) Алтайского государственного технического университета им. И.И. Ползунова,http://www.bti.secna.ru/,0.671,0.671,0.537
5,"Ростовский филиал государственного казенного образовательного учреждения высшего образования ""Российская таможенная академия""",http://donrta.customs.ru,0.67,0.67,0.469
5,Волжский политехнический институт (филиал) Волгоградского государственного технического университета,http://www.volpi.ru/,0.669,0.669,0.534
5,"Государственный институт экономики, финансов, права и технологий",http://www.gief.ru,0.669,0.669,0.465
5,Восточно-Европейский институт,http://www.veinst.ru,0.669,0.669,0.367
5,Нижегородский государственный архитектурно-строительный университет,http://www.nngasu.ru/,0.668,0.668,0.639
5,Ярославская духовная семинария Ярославской Епархии Русской Православной Церкви,http://yarseminaria.ru/,0.668,0.668,0.625
5,Пермский филиал РАНХиГС,http://perm.ranepa.ru/,0.667,0.667,0.51
5,Алтайский институт труда и права (филиал) Академии труда и социальных отношений,http://aitip.ru/,0.667,0.667,0.384
5,Дальневосточный государственный аграрный университет,http://www.dalgau.ru/,0.666,0.522,0.666
5,Байкальский экономико-правовой институт,http://www.bepi-edu.ru,0.664,0.664,0.486
5,филиал Дагестанского государственного университета в г. Избербаше,http://dgu-izberbash.ru,0.664,0.664,0.384
5,Новосибирская православная духовная семинария,http://dsnsk.ru,0.663,0.663,0.564
5,Ставропольский государственный медицинский университет,https://stgmu.ru,0.663,0.663,0.534
5,Красноярский государственный медицинский университет имени профессора В.Ф.Войно-Ясенецкого,https://krasgmu.ru/,0.663,0.663,0.517
5,Национальный центр профессионально-общественной аккредитации,http://ukc-nica.ru,0.661,0.661,0.554
5,Учебно-консультационный центр,http://ukc-nica.ru,0.661,0.661,0.554
5,Московский государственный областной университет,https://mgou.ru/,0.661,0.661,0.486
5,Фрязинский филиал Московского государственного областного университета,https://mgou.ru/,0.661,0.661,0.486
5,Российская академия музыки имени Гнесиных,http://www.gnesin-academy.ru,0.66,0.66,0.38
5,Брянский государственный технический университет,https://www.tu-bryansk.ru/,0.659,0.659,0.506
5,Сретенская духовная семинария Русской Православной Церкви,http://sdsmp.ru/,0.658,0.658,0.544
5,Омская юридическая академия,http://omua.ru,0.658,0.658,0.517
5,"Пятигорский медико-фармацевтический институт - филиал ""Волгоградского государственного медицинского университета"" Министерства здравоохранения Российской Федерации",http://www.pmedpharm.ru,0.658,0.658,0.51
5,Кубанский институт информзащиты,http://kiiz.info,0.658,0.658,0.503
5,Уральский государственный университет физической культуры,http://uralgufk.ru,0.658,0.658,0.496
5,Автомобильно-транспортный институт,http://vrnvuz.ru,0.657,0.657,0.561
5,Тульская духовная семинария Тульской Епархии Русской Православной Церкви,https://tulds.ru,0.657,0.657,0.53
5,Государственный институт русского языка им. А.С. Пушкина,http://pushkin.institute,0.657,0.657,0.523
5,"Северо-Кавказский ""Московского технического университета связи и информатики"" (СКФ МТУСИ)",http://skf-mtusi.ru/,0.654,0.654,0.496
5,Дагестанский государственный аграрный университет имени М.М.Джамбулатова,http://даггау.рф,0.653,0.653,0.571
5,Дагестанский государственный медицинский университет,http://dgmu.ru/,0.653,0.653,0.571
5,Российский государственный аграрный заочный университет,http://www.rgazu.ru,0.651,0.651,0.5
5,Северо-Кавказский горно-металлургический институт (государственный технологический университет),http://www.skgmi-gtu.ru/ru-ru/,0.65,0.65,0.476
5,МИРЭА — Российский технологический университет,https://www.mirea.ru/,0.649,0.649,0.503
5,Дербентский филиал Общества с ограниченной ответственностью «Азербайджанский Государственный Экономический Университет»,http://ageu-derbent.ru/,0.647,0.647,0.547
5,Шадринский государственный педагогический университет,http://shgpi.edu.ru,0.646,0.646,0.517
5,Казанский инновационный университет имени В.Г.Тимирясова (ИЭУП),http://ieml.ru,0.644,0.644,0.534
5,Нижнекамский филиал Казанского инновационного университета имени В.Г.Тимирясова,http://www.ieml.ru,0.644,0.644,0.534
5,"Петрозаводский филиал федерального государственного бюджетного образовательного учреждения высшего образования ""Петербургский государственный университет путей сообщения Императора Александра I""",http://pgups-karelia.ru,0.644,0.644,0.534
5,Московский открытый институт,http://www.moi.edu.ru,0.643,0.643,0.479
5,Нижегородский государственный технический университет им. Р.Е. Алексеева,http://www.nntu.ru,0.642,0.642,0.534
5,Санкт-Петербургский институт (филиал) «Всероссийского государственного университета юстиции (РПА Минюста России)»,https://spb.rpa-mu.ru,0.642,0.642,0.442
5,Филиал Ростовского государственного экономического университета в г. Махачкала,http://www.rsue-rd.ru,0.641,0.641,0.523
5,Муромский институт (филиал) Владимирского государственного университета имени Александра Григорьевича и Николая Григорьевича Столетовых,http://www.mivlgu.ru/,0.639,0.639,0.51
5,Астраханский государственный архитектурно - строительный университет,http://агасу.рф/,0.639,0.639,0.506
5,"Харабалинский филиал ""Астраханского государственного архитектурно-строительного университета""",http://агасу.рф,0.639,0.639,0.506
5,Воронежский экономико-правовой институт,http://www.vepi.ru,0.639,0.639,0.493
5,Чистопольский филиал Казанского инновационного университета имени В.Г.Тимирясова,http://chs.ieml.ru,0.639,0.639,0.476
5,"Карачаево-Черкесский филиал Негосударственного образовательного частного учреждения высшего образования ""Московский финансово - промышленный университет ""Синергия""",http://chs.synergy.ru,0.638,0.638,0.506
5,"Филиал ФБГОУ ВПО ""Удмуртский государственный университет"" в г. Губкинском",http://www.udgug.ru/,0.638,0.638,0.479
5,"Якутский филиал негосударственного образовательного учреждения высшего профессионального образования ""Институт государственного администрирования""",https://yakutsk.iga.ru,0.637,0.637,0.51
5,Сибирский институт бизнеса и информационных технологий,http://sibit.sano.ru,0.636,0.636,0.564
5,Нижневартовский государственный университет,http://nvsu.ru,0.636,0.636,0.408
5,Магнитогорский государственный технический университет им. Г.И. Носова,http://magtu.ru/,0.635,0.635,0.588
5,Российский новый университет,http://www.rosnou.ru,0.634,0.634,0.428
5,"Санкт-Петербургский институт внешнеэкономических связей, экономики и права",http://ivesep.spb.ru,0.633,0.633,0.523
5,Стерлитамакский филиал Башкирского государственного университета,http://strbsu.ru,0.633,0.633,0.52
5,Глазовский инженерно-экономический институт,http://www.gfi.edu.ru/,0.633,0.633,0.486
5,Санкт-Петербургский государственный институт кино и телевидения,http://www.gukit.ru,0.633,0.633,0.35
5,Филиал федерального государственного бюджетного образовательного учреждения высшего образования «Кубанский государственный университет» в г.Новороссийске,http://www.nvr.kubsu.ru/new/,0.631,0.631,0.496
5,Российский государственный гидрометеорологический университет,http://www.rshu.ru,0.63,0.63,0.537
5,"Башкирский институт физической культуры (филиал) ФГБОУ ВО ""УралГУФК""",http://www.bifk.ru,0.628,0.628,0.459
5,Институт экономики и права (филиал) Академии труда и социальных отношений,http://sevatiso.ru/,0.627,0.627,0.465
5,БЕЛГОРОДСКАЯ ПРАВОСЛАВНАЯ ДУХОВНАЯ СЕМИНАРИЯ,http://www.bel-seminaria.ru,0.626,0.626,0.557
5,Астраханская государственная консерватория (академия),http://astracons.ru/,0.626,0.626,0.551
5,Волгоградский государственный аграрный университет,http://www.volgau.com/,0.625,0.625,0.472
5,Ивановский государственный политехнический университет,http://www.ivgpu.com,0.623,0.623,0.448
5,Московская государственная академия водного транспорта,https://www.msawt.ru,0.622,0.622,0.435
5,Московский государственный психолого-педагогический университет,https://mgppu.ru/,0.622,0.622,0.36
5,Тамбовский государственный технический университет,http://www.tstu.ru/,0.622,0.611,0.622
5,Кемеровский государственный институт культуры,http://www.kemguki.ru,0.621,0.621,0.476
5,Ивановский государственный университет,http://www.ivanovo.ac.ru/,0.621,0.621,0.438
5,"Филиал ФГБОУ ВО ""Адыгейский государственный университет"" в г.Белореченске",http://www.agubel.ru,0.621,0.621,0.343
5,Среднерусский институт управления - филиал РАНХиГС,http://www.orel.ranepa.ru,0.62,0.62,0.445
5,Международный институт компьютерных технологий,http://www.iict.ru,0.619,0.619,0.523
5,Ульяновский государственный университет,http://www.ulsu.ru/1.html,0.619,0.619,0.513
5,Котласский филиал Государственного университета морского и речного флота имени адмирала С.О.Макарова,http://www.kfgumrf.ru/,0.619,0.619,0.465
5,Саратовский государственный медицинский университет имени В.И. Разумовского,http://www.sgmu.ru,0.618,0.618,0.482
5,Ивановский филиал РАНХиГС,http://iv.ranepa.ru/,0.618,0.618,0.414
5,"Филиал Автономной некоммерческой образовательной организации высшего образования ""Воронежский экономико-правовой институт"" в г.Липецк",http://lipetsk.vepi.ru,0.617,0.617,0.486
5,"Филиал Автономной некоммерческой образовательной организации высшего образования ""Воронежский экономико-правовой институт"" в г.Орёл",https://orel.vepi.ru,0.617,0.617,0.486
5,"Филиал Автономной некоммерческой образовательной организации высшего образования ""Воронежский экономико-правовой институт"" в г.Россошь",https://rossosh.vepi.ru,0.617,0.617,0.486
5,"Филиал Автономной некоммерческой образовательной организации высшего образования ""Воронежский экономико-правовой институт"" в г.Старый Оскол",http://oskol.vepi.ru,0.617,0.617,0.486
5,Курганский филиал РАНХиГС,http://kurg.ranepa.ru/,0.617,0.617,0.353
5,Уральская государственная консерватория имени М.П.Мусоргского,http://www.uralconsv.org/,0.614,0.614,0.513
5,Региональный финансово-экономический институт,https://rfei.ru/,0.613,0.613,0.503
5,Октёмский филиал ФГБОУ ВО Якутская ГСХА,http://www.ysaa.ru,0.613,0.613,0.493
5,Якутская государственная сельскохозяйственная академия,https://ysaa.ru/,0.613,0.613,0.493
5,"Дзержинский политехнический институт (филиал) ""Нижегородского государственного технического университета им. Р.Е. Алексеева""",http://dpingtu.ru/,0.612,0.612,0.489
5,Политехнический институт (филиал) «Северо-Восточного федерального университета имени М.К.Аммосова» в г. Мирном,https://www.s-vfu.ru/universitet/rukovodstvo-i-struktura/instituty/mpti/,0.612,0.612,0.397
5,Тихоокеанский государственный медицинский университет,https://tgmu.ru/,0.612,0.612,0.346
5,Дагестанский государственный университет народного хозяйства,http://www.dgunh.ru,0.611,0.611,0.489
5,Южно-Уральский государственный институт искусств имени П.И. Чайковского,http://uyrgii.ru,0.611,0.611,0.452
5,Институт технологий (филиал) Донского государственного технического университета в г. Волгодонске,http://www.vis2.ru/,0.609,0.609,0.401
5,Пермский государственный национальный исследовательский университет,http://www.psu.ru,0.609,0.609,0.387
5,Тобольский педагогический институт им. Д.И. Менделеева (филиал) федерального государственного бюджетного образовательного учреждения высшего образования «Тюменский государственный университет» в г. Тобольск,https://tobolsk.utmn.ru/,0.609,0.609,0.363
5,Тверской филиал РАНХиГС,http://tver.ranepa.ru/,0.608,0.608,0.445
5,Норильский государственный индустриальный институт,http://www.norvuz.ru,0.607,0.607,0.489
5,Северный институт предпринимательства,http://www.nousip.ru,0.607,0.607,0.486
5,"Филиал ""Котельники"" государственного бюджетного образовательного учреждения высшего образования Московской области ""Университет ""Дубна""",http://un-fkt.ru,0.607,0.607,0.486
5,Московская государственная художественно-промышленная академия им. С.Г. Строганова,http://www.mghpu.ru,0.606,0.606,0.482
5,"Филиал ""Взлет"" федерального государственного бюджетного образовательного учреждения высшего образования ""Московский авиационный институт (национальный исследовательский университет) в г.Ахтубинске""",https://vzlet.mai.ru/,0.606,0.606,0.353
