Лига,вуз,Сайт,J,Jvikon,Jпаук
12,Альметьевский государственный нефтяной институт,http://www.agni-rt.ru,0.0,0.0,0.0
12,Альметьевский филиал Казанского инновационного университета имени В.Г.Тимирясова,http://alm.ieml.ru,0.0,0.0,0.0
12,"Армавирский механико-технологический институт (филиал) ФГБОУ ВО ""КубГТУ""",http://www.amti.ru,0.0,0.0,0.0
12,"Артемовский филиал ""Уральского института экономики, управления и права""",http://www.urep.ru/index.php?option=com_content&view=article&id=1025&Itemid=297&lang=ru,0.0,0.0,0.0
12,"Астраханский филиал ЧОУ ВПО ""Институт социальных и гуманитарных знаний""",http://www.astrisgz.ru,0.0,0.0,0.0
12,"Байкало-Амурский институт железнодорожного транспорта - филиал федерального государственного бюджетного образовательного учреждения высшего образования ""Дальневосточный государственный университет путей сообщения"" в г. Тынде",http://www.tynda.ru,0.0,0.0,0.0
12,Байкальский институт управления,http://www.biu.ru,0.0,0.0,0.0
12,Балтийская государственная академия рыбопромыслового флота обособленное структурное подразделение Калининградского государственного технического университета,http://bgarf.ru,0.0,0.0,0.0
12,Балтийский институт иностранных языков и межкультурного сотрудничества,http://www.buflic.org,0.0,0.0,0.0
12,Барнаульский филиал Финансового университета при Правительстве Российской Федерации,http://www.barnaul.fa.ru,0.0,0.0,0.0
12,Белгородский государственный институт искусств и культуры,http://bgiik.ru/,0.0,0.0,0.0
12,Богословская семинария Сибирской Евангелическо-Лютеранской Церкви,http://www.lts.ru,0.0,0.0,0.0
12,Бронницкий филиал МАДИ,http://www.bronmadi.ru,0.0,0.0,0.0
12,"Брянский филиал Автономной некоммерческой организации высшего образования ""Международная академия бизнеса и управления""",http://mabiu.ru/filialy/bryansk/,0.0,0.0,0.0
12,Бугульминский филиал Казанского инновационного университета имени В.Г.Тимирясова,http://bug.ieml.ru,0.0,0.0,0.0
12,"Буддийский университет ""Даши Чойнхорлин"" имени Дамба Даржа Заяева",http://budduniver.ru,0.0,0.0,0.0
12,Бурятский институт инфокоммуникаций (филиал) Сибирского государственного университета телекоммуникаций и информатики в г.Улан-Удэ,http://biik.ru/,0.0,0.0,0.0
12,"Великолукский филиал ""Петербургского государственного университета путей сообщения Императора Александра I""",http://vf-pgups.ru/,0.0,0.0,0.0
12,"Владивостокский филиал ""Российской таможенной академии""",http://vfrta.customs.ru/,0.0,0.0,0.0
12,Владивостокский филиал негосударственного образовательного учреждения высшего образования «Санкт-Петербургский Гуманитарный университет профсоюзов»,http://gup-vl.ru/,0.0,0.0,0.0
12,Владикавказский филиал Финансового университета при Правительстве Российской Федерации,http://www.vladik.fa.ru/,0.0,0.0,0.0
12,Владимирский институт туризма и гостеприимства,http://vvitig.ru,0.0,0.0,0.0
12,Владимирский филиал Финансового университета при Правительстве Российской Федерации,http://www.old.fa.ru/fil/vladimir/Pages/default.aspx,0.0,0.0,0.0
12,Владимирский юридический институт ФСИН,http://www.vui.fsin.su/,0.0,0.0,0.0
12,Военно-медицинская академия имени С.М.Кирова,https://www.vmeda.org/,0.0,0.0,0.0
12,Волго-Вятский институт (филиал) ФГБОУ ВО «Московский государственный юридический университет имени О.Е. Кутафина» (МГЮА),http://www.msalkirov.ru,0.0,0.0,0.0
12,Волгоградская консерватория им. П.А.Серебрякова,http://serebryakovka.ru,0.0,0.0,0.0
12,Волгоградский гуманитарный институт,http://www.vggi.ru,0.0,0.0,0.0
12,"Волгодонский институт экономики, управления и права (филиал) федерального государственного автономного образовательного учреждения высшего образования "" Южный федеральный университет""",http://vdonskrsu.narod.ru,0.0,0.0,0.0
12,Волжский филиал МАДИ,http://www.vf.madi.ru/,0.0,0.0,0.0
12,Волжский филиал Образовательного частного учреждения высшего образования «Международный юридический институт» (Волжский филиал),http://lawacademy.ru/volzhskiy/,0.0,0.0,0.0
12,"Вологодский филиал ""Международной академии бизнеса и новых технологий (МУБиНТ)""",http://www.mubint.ru/filials/vologda/,0.0,0.0,0.0
12,Воркутинский филиал Ухтинского государственного технического университета,http://www.vfugtu.ru/,0.0,0.0,0.0
12,Воронежский институт - филиал ФГБОУ ВО Ивановской пожарно-спасательной академии ГПС МЧС России,http://vf.edufire37.ru/,0.0,0.0,0.0
12,Воронежский институт Министерства внутренних дел Российской Федерации,http://www.vimvd.ru,0.0,0.0,0.0
12,Воронежский институт Федеральной службы исполнения наказаний,http://vi.fsin.su,0.0,0.0,0.0
12,Воронежский институт экономики и социального управления,http://www.viesm.vrn.ru,0.0,0.0,0.0
12,Воскресенский институт туризма - филиал РМАТ,http://www.rmatvf.ru,0.0,0.0,0.0
12,"Восточно-Сибирский филиал Федерального государственного бюджетного образовательного учреждения высшего образования ""Российский государственный университет правосудия""(г. Иркутск)",http://esb.rgup.ru,0.0,0.0,0.0
12,"Выборгский филиал ""Санкт-Петербургского государственного университета гражданской авиации""",http://vatuga.ru/,0.0,0.0,0.0
12,Выборгский филиал Российского государственного педагогического университета им. А. И. Герцена,https://www.herzen.spb.ru/sveden/common/vyborg/,0.0,0.0,0.0
12,Выксунский филиал «Национального исследовательского Нижегородского государственного университета им. Н.И. Лобачевского»,http://www.unn.ru/cdo/Vyksa.html,0.0,0.0,0.0
12,Высшая школа народных искусств (институт),http://www.vshni.ru,0.0,0.0,0.0
12,Высшее театральное училище (институт) им.М.С.Щепкина при Государственном академическом Малом театре России,http://shepkinskoe.ru,0.0,0.0,0.0
12,Государственный музыкально-педагогический институт имени М.М. Ипполитова-Иванова,http://www.ippolitovka.ru/,0.0,0.0,0.0
12,Государственный университет по землеустройству,https://www.guz.ru/,0.0,0.0,0.0
12,Губкинский филиал Белгородского государственного института искусств и культуры (БГИИК),http://bgiik.ru/1100,0.0,0.0,0.0
12,"Гуковский институт экономики и права (филиал) федерального государственного бюджетного образовательного учреждения высшего образования ""Ростовский государственный экономический университет (РИНХ)""",http://giep-rgeu.ru/,0.0,0.0,0.0
12,Гуманитарно-педагогическая академия (филиал) федерального государственного автономного образовательного учреждения высшего образования «Крымский федеральный университет имени В.И. Вернадского» в г. Ялте,http://gpa.cfuv.ru/,0.0,0.0,0.0
12,Дагестанская академия образования и культуры,http://daok-derbent.ru,0.0,0.0,0.0
12,Дагестанский государственный педагогический университет,http://dgpu.net/ru/,0.0,0.0,0.0
12,Дагестанский теологический институт имени Саида афанди,http://dagteolog.ru,0.0,0.0,0.0
12,Дагестанский филиал Российского государственного педагогического университета им. А. И. Герцена,https://www.herzen.spb.ru/main/structure/filial/dagestanskiiy/common/,0.0,0.0,0.0
12,Дальневосточный государственный медицинский университет,http://www.fesmu.ru/,0.0,0.0,0.0
12,Дальневосточный государственный университет путей сообщения,http://www.dvgups.ru,0.0,0.0,0.0
12,Дальневосточный филиал ФГБОУ ВО ВАВТ Минэкономразвития России,http://dvf-vavt.ru,0.0,0.0,0.0
12,"Дальневосточный филиал Федерального государственного бюджетного образовательного учреждения высшего образования ""Российский государственный университет правосудия"" (г. Хабаровск)",http://feb.rgup.ru,0.0,0.0,0.0
12,"Дзержинский филиал федерального государственного автономного образовательного учреждения высшего образования ""Национальный исследовательский Нижегородский государственный университет им.Н.И.Лобачевского""",http://www.unn.ru/cdo/Dzerzhinsk.html,0.0,0.0,0.0
12,Димитровградский инженерно-технологический институт,http://diti-mephi.ru/,0.0,0.0,0.0
12,"Домодедовский филиал автономной некоммерческой организации высшего о образования ""Российский новый университет""",http://df.rosnou.ru,0.0,0.0,0.0
12,"Донецкий Институт управления, бизнеса и права ""Южного университета (ИУБиП)""",http://www.dfiubip.ru,0.0,0.0,0.0
12,Донская духовная семинария Ростовской-на-Дону Епархии Русской Православной Церкви,http://donseminary.ru/,0.0,0.0,0.0
12,"духовное профессиональное образовательное учреждение ""Агинская Буддийская Академия""",http://aginskydatsan.ru,0.0,0.0,0.0
12,Евразийский лингвистический институт в г. Иркутске - филиал федерального государственного бюджетного образовательного учреждения высшего профессионального образования «Московский государственный лингвистический университет»,http://www.islu.ru,0.0,0.0,0.0
12,Европейский университет права Justo (институт),https://ejusto.ru/,0.0,0.0,0.0
12,Екатеринбургская духовная семинария Екатеринбургской Епархии Русской Православной Церкви,https://epds.ru/,0.0,0.0,0.0
12,Екатеринбургский государственный театральный институт,http://www.egti.ru,0.0,0.0,0.0
12,Заокский христианский гуманитарно-экономический институт,http://institute.zau.ru/,0.0,0.0,0.0
12,Заочный теологический институт христиан Веры Евангельской,https://ztihve.ru,0.0,0.0,0.0
12,"Западно-Сибирский филиал ""Российского государственного университета правосудия""(г. Томск)",http://www.wsb.rgup.ru,0.0,0.0,0.0
12,Зареченский технологический институт - филиал Пензенского государственного технологического университета,http://www.penzgtu.ru,0.0,0.0,0.0
12,Ивановская пожарно-спасательная академия ГПС МЧС России,http://www.edufire37.ru/,0.0,0.0,0.0
12,Ивантеевский филиал Московского политеха,http://ivanteevka.mospolytech.ru/,0.0,0.0,0.0
12,Инзенский филиал Ульяновского государственного университета,http://www.ulsu.ru/ru/sveden/struct/13829061-f201-11de-8bdd-001a92e75bb4/,0.0,0.0,0.0
12,Институт «Верхневолжье»,https://uppervolga.com/,0.0,0.0,0.0
12,Институт государственной службы и управления РАНХиГС,http://igsu.ranepa.ru/,0.0,0.0,0.0
12,Институт журналистики и литературного творчества,http://www.iglt.ru/,0.0,0.0,0.0
12,Институт иностранных языков,http://www.ifl.ru,0.0,0.0,0.0
12,"Институт информационных технологий, экономики и менеджмента",http://иитэм.рф,0.0,0.0,0.0
12,Институт искусства реставрации,http://www.resvuz.ru,0.0,0.0,0.0
12,Институт международных связей,http://www.ims-ural.ru,0.0,0.0,0.0
12,Институт образовательных технологий и гуманитарных наук,http://iotgn.ru/,0.0,0.0,0.0
12,Институт пищевых технологий и дизайна,http://www.iptdnn.ru/,0.0,0.0,0.0
12,Институт программных систем УГП имени А.К. Айламазяна,http://u.pereslavl.ru,0.0,0.0,0.0
12,"Институт радиоэлектроники, сервиса и диагностики",https://irsid.ru/,0.0,0.0,0.0
12,Институт сервиса и технологий (филиал) ДГТУ в г. Пятигорске,http://www.Kmvis.com,0.0,0.0,0.0
12,"Институт сервиса, туризма и дизайна (филиал) федерального государственного автономного образовательного учреждения высшего образования ""Северо-Кавказский федеральный университет""",http://pf.ncfu.ru,0.0,0.0,0.0
12,Институт социальных наук,http://www.socius.ru,0.0,0.0,0.0
12,Институт специальной педагогики и психологии,http://wallenberg.ru/,0.0,0.0,0.0
12,Институт стран Востока,http://www.orun.ru/,0.0,0.0,0.0
12,"Институт телевидения, бизнеса и дизайна",http://itid.ru/,0.0,0.0,0.0
12,Институт УНИК,https://unic.edu.ru/,0.0,0.0,0.0
12,Институт управления и права,http://iup.com.ru/,0.0,0.0,0.0
12,Институт финансов и права,http://www.ifip05.ru,0.0,0.0,0.0
12,"Институт финансов, экономики и права офицеров запаса",http://ifepoz.ru,0.0,0.0,0.0
12,Институт экономики и управления (г.Пятигорск),http://www.ineu.ru,0.0,0.0,0.0
12,Иркутский филиал Всероссийского государственного института кинематографии имени С.А. Герасимова,http://irkvgik.ru,0.0,0.0,0.0
12,Иркутский филиал РАНХиГС,http://irk.ranepa.ru/,0.0,0.0,0.0
12,Иркутский филиал РЭУ им. Г.В. Плеханова,http://www.ifrsute.ru,0.0,0.0,0.0
12,Исламский университет имени Имама Ашъари,http://www.ashari.ru,0.0,0.0,0.0
12,Исследовательский центр частного права имени С.С. Алексеева при Президенте Российской Федерации,http://privlaw.ru/rsshp/,0.0,0.0,0.0
12,"Ишимский педагогический институт им. П.П. Ершова (филиал) ФГБОУ ВО "" Тюменский государственный университет""",https://ishim.utmn.ru/,0.0,0.0,0.0
12,Казанский (Приволжский) федеральный университет,https://kpfu.ru/,0.0,0.0,0.0
12,Казанский государственный архитектурно-строительный университет,http://www.kgasu.ru,0.0,0.0,0.0
12,Казанский институт предпринимательства и права,https://киппвуз.рф/,0.0,0.0,0.0
12,"Казанский филиал ""Российского государственного университета правосудия""(г. Казань)",http://www.kb.rgup.ru/,0.0,0.0,0.0
12,Казанский филиал Академии труда и социальных отношений,http://www.atisokzn.ru,0.0,0.0,0.0
12,Калининградский институт управления,https://kiu39.ru,0.0,0.0,0.0
12,"Калининградский филиал АНОВО ""МЕЖДУНАРОДНЫЙ УНИВЕРСИТЕТ В МОСКВЕ""",http://primary.kfmum.ru,0.0,0.0,0.0
12,Калмыцкий филиал Московского государственного гуманитарно-экономического института,http://kfilial.mggeu.ru/,0.0,0.0,0.0
12,Калужская духовная семинария Калужской Епархии Русской Православной Церкви,http://kalugads.ru,0.0,0.0,0.0
12,Калужский филиал Финансового университета при Правительстве Российской Федерации,http://www.kaluga.fa.ru/,0.0,0.0,0.0
12,"Каменск-Уральский филиал НАЧОУВО""Уральский институт экономики, управления и права""",http://www.urep.ru/index.php?option=com_content&view=article&id=1336&Itemid=115&lang=ru,0.0,0.0,0.0
12,Каменский технологический институт,http://kamti.penzgtu.ru/,0.0,0.0,0.0
12,Карачаево-Черкесский государственный университет имени У.Д.Алиева,http://кчгу.рф,0.0,0.0,0.0
12,Кемеровский государственный сельскохозяйственный институт,http://www.ksai.ru,0.0,0.0,0.0
12,Керченский филиал «Крымского инженерно-педагогического университета»,http://kerch.kipu-rc.ru/,0.0,0.0,0.0
12,Кировский институт иностранных языков,http://www.kirovinyaz.ru,0.0,0.0,0.0
12,"Кировский филиал негосударственного образовательного учреждения высшего образования ""Санкт-Петербургский Гуманитарный университет профсоюзов""",http://spbgupkirov.ru/,0.0,0.0,0.0
12,"Королёвский филиал Образовательного частного учреждения высшего образования ""Международный юридический институт"" (Королёвский филиал)",http://lawacademy.ru/korolev/,0.0,0.0,0.0
12,Костромская духовная семинария Костромской Епархии Русской Православной Церкви,http://kods.cerkov.ru/,0.0,0.0,0.0
12,КПИ (филиал) УрФУ,http://upi.kamensktel.ru,0.0,0.0,0.0
12,Краснодарский филиал Финансового университета при Правительстве Российской Федерации,http://www.old.fa.ru/fil/krasnodar/news/Pages/index.aspx,0.0,0.0,0.0
12,Краснокутский филиал Саратовского государственного аграрного университета имени Н.И. Вавилова,http://www.sgau.ru/filialy-universiteta/krasnokutskii-filial,0.0,0.0,0.0
12,Красноярский институт железнодорожного транспорта,http://www.krsk.irgups.ru,0.0,0.0,0.0
12,Красноярский филиал негосударственного образовательного учреждения высшего образования «Санкт-Петербургский Гуманитарный университет профсоюзов»,http://www.krasgup.ru,0.0,0.0,0.0
12,Красноярский филиал Санкт-Петербургского государственного университета гражданской авиации,http://kfspbguga.ru/,0.0,0.0,0.0
12,Крымский инженерно-педагогический университет,http://kipu-rc.ru/,0.0,0.0,0.0
12,Крымский институт бизнеса,http://киб-крым.рф,0.0,0.0,0.0
12,"Крымский филиал Федерального государственного бюджетного образовательного учреждения высшего образования ""Российский государственный университет правосудия"" ( КрФ ФГБОУВО ""РГУП"")",http://www.crb.rgup.ru,0.0,0.0,0.0
12,Крымский юридический институт (филиал) «Университета прокуратуры Российской Федерации»,http://www.simagp.ru/,0.0,0.0,0.0
12,Кубанский евангельский христианский университет,http://kecu.ru,0.0,0.0,0.0
12,Кузбасский институт Федеральной службы исполнения наказаний,http://ki.fsin.su,0.0,0.0,0.0
12,Курганский филиал Академии труда и социальных отношений,http://kfatso.ru/html/,0.0,0.0,0.0
12,"Курганский филиал НАЧОУВО ""Уральский институт экономики, управления и права""",http://www.urep.ru/index.php?option=com_content&view=article&id=643&Itemid=112&lang=ru,0.0,0.0,0.0
12,Курский филиал Финансового университета при Правительстве Российской Федерации,http://www.fa.ru/fil/kursk/,0.0,0.0,0.0
12,Липецкий филиал Финансового университета при Правительстве Российской Федерации,http://www.fa.ru/fil/lipetsk/Pages/Home.aspx,0.0,0.0,0.0
12,Липецкий эколого - гуманитарный институт,http://лэги48.рф/,0.0,0.0,0.0
12,"Лысьвенский филиал федерального государственного бюджетного образовательного учреждения высшего образования ""Пермский национальный исследовательский политехнический университет""",http://lf.pstu.ru,0.0,0.0,0.0
